{
  "format": "compat-lock/v1",
  "generated_at": "2026-04-14T19:31:19.665Z",
  "tool": {
    "generator": "compat-generate-lock/0.1.1",
    "scanner": "sample-scanner/1.0.0",
    "registry": "sample-scanner-registry/1",
    "datasets": {
      "bcd": {
        "version": "fixture-2026.04.13",
        "timestamp": "2026-04-13T00:00:00.000Z"
      }
    }
  },
  "floor_requirements": [
    {
      "kind": "bcd",
      "ref": "bcd:api.IDBFactory.open",
      "key": "api.IDBFactory.open",
      "selector": {
        "prefix": null,
        "alternative_name": null,
        "allow_flags": false,
        "allow_partial_implementation": false
      },
      "evidence": [],
      "resolved": {
        "chrome": {
          "reason": null,
          "from": "23",
          "release_date": "2012-11-06",
          "removed_in": null,
          "removed_release_date": null,
          "last_supported": null,
          "monotonic": true,
          "statement": {
            "version_added": "23"
          },
          "state": "exact"
        }
      },
      "spec": [
        "https://w3c.github.io/IndexedDB/#dom-idbfactory-open"
      ]
    },
    {
      "kind": "bcd",
      "ref": "bcd:html.elements.dialog",
      "key": "html.elements.dialog",
      "selector": {
        "prefix": null,
        "alternative_name": null,
        "allow_flags": false,
        "allow_partial_implementation": false
      },
      "evidence": [],
      "resolved": {
        "chrome": {
          "reason": null,
          "from": "37",
          "release_date": "2014-08-26",
          "removed_in": null,
          "removed_release_date": null,
          "last_supported": null,
          "monotonic": true,
          "statement": {
            "version_added": "37"
          },
          "state": "exact"
        }
      },
      "spec": [
        "https://html.spec.whatwg.org/multipage/interactive-elements.html#the-dialog-element"
      ]
    }
  ],
  "requirements": [
    {
      "kind": "bcd",
      "ref": "bcd:api.Navigator.share",
      "key": "api.Navigator.share",
      "selector": {
        "prefix": null,
        "alternative_name": null,
        "allow_flags": false,
        "allow_partial_implementation": false
      },
      "evidence": [
        {
          "path": "examples/example-app/dist/app.js",
          "loc": "3:7-3:21",
          "rule": "js/property/Navigator.share",
          "snippet": "navigator.share"
        }
      ],
      "resolved": {
        "chrome": {
          "reason": null,
          "from": "61",
          "release_date": "2017-09-05",
          "removed_in": null,
          "removed_release_date": null,
          "last_supported": null,
          "monotonic": true,
          "statement": {
            "version_added": "61"
          },
          "state": "exact"
        }
      },
      "spec": [
        "https://w3c.github.io/web-share/#dom-navigator-share"
      ]
    },
    {
      "kind": "bcd",
      "ref": "bcd:css.properties.text-wrap",
      "key": "css.properties.text-wrap",
      "selector": {
        "prefix": null,
        "alternative_name": null,
        "allow_flags": false,
        "allow_partial_implementation": false
      },
      "evidence": [
        {
          "path": "examples/example-app/dist/app.css",
          "loc": "2:2-2:12",
          "rule": "css/property/text-wrap",
          "snippet": " text-wrap:"
        }
      ],
      "resolved": {
        "chrome": {
          "reason": null,
          "from": "114",
          "release_date": "2023-05-30",
          "removed_in": null,
          "removed_release_date": null,
          "last_supported": null,
          "monotonic": true,
          "statement": {
            "version_added": "114"
          },
          "state": "exact"
        }
      },
      "spec": [
        "https://drafts.csswg.org/css-text-4/#text-wrap-property"
      ]
    },
    {
      "kind": "manual",
      "ref": "manual:behavior.structured-clone.transfer",
      "id": "behavior.structured-clone.transfer",
      "title": "Structured clone with transfer support",
      "reason": "Application depends on a semantic boundary not represented by a single BCD key.",
      "support": {
        "chrome": "104"
      },
      "source": [
        "https://html.spec.whatwg.org/multipage/structured-data.html#structuredserializewithtransfer"
      ],
      "resolved": {
        "chrome": {
          "state": "exact",
          "reason": "manual",
          "from": "104",
          "release_date": null,
          "removed_in": null,
          "removed_release_date": null,
          "last_supported": null,
          "monotonic": true,
          "statement": {
            "version_added": "104",
            "manual": true
          }
        }
      }
    }
  ],
  "summary": {
    "by_browser": {
      "chrome": {
        "state": "exact",
        "derived_floor": "114",
        "known_floor": "114",
        "monotonic": true,
        "requirements": [
          {
            "ref": "bcd:api.IDBFactory.open",
            "reason": null,
            "from": "23",
            "release_date": "2012-11-06",
            "removed_in": null,
            "removed_release_date": null,
            "last_supported": null,
            "monotonic": true,
            "statement": {
              "version_added": "23"
            },
            "state": "exact"
          },
          {
            "ref": "bcd:html.elements.dialog",
            "reason": null,
            "from": "37",
            "release_date": "2014-08-26",
            "removed_in": null,
            "removed_release_date": null,
            "last_supported": null,
            "monotonic": true,
            "statement": {
              "version_added": "37"
            },
            "state": "exact"
          },
          {
            "ref": "bcd:api.Navigator.share",
            "reason": null,
            "from": "61",
            "release_date": "2017-09-05",
            "removed_in": null,
            "removed_release_date": null,
            "last_supported": null,
            "monotonic": true,
            "statement": {
              "version_added": "61"
            },
            "state": "exact"
          },
          {
            "ref": "bcd:css.properties.text-wrap",
            "reason": null,
            "from": "114",
            "release_date": "2023-05-30",
            "removed_in": null,
            "removed_release_date": null,
            "last_supported": null,
            "monotonic": true,
            "statement": {
              "version_added": "114"
            },
            "state": "exact"
          },
          {
            "ref": "manual:behavior.structured-clone.transfer",
            "state": "exact",
            "reason": "manual",
            "from": "104",
            "release_date": null,
            "removed_in": null,
            "removed_release_date": null,
            "last_supported": null,
            "monotonic": true,
            "statement": {
              "version_added": "104",
              "manual": true
            }
          }
        ]
      }
    }
  }
}
